{
  "schemaVersion": 1,
  "id": "khuc-thua-du",
  "slug": "khuc-thua-du",
  "order": 8,
  "period": "bac-thuoc",
  "title": {
    "vi": "Họ Khúc",
    "en": "The Khúc Lords"
  },
  "kicker": {
    "vi": "Kỷ tự chủ họ Khúc",
    "en": "The Khúc self-rule"
  },
  "subtitle": {
    "vi": "Đặt nền tự chủ, mở lối độc lập.",
    "en": "The foundation of self-rule, the road to independence."
  },
  "overview": {
    "vi": "Cuối đời Đường, nhà Đường suy vi rồi sụp đổ, Trung Quốc bước vào thời Ngũ Đại loạn lạc. Nhân thế, năm 905 người Hồng Châu là Khúc Thừa Dụ đem dân chúng chiếm giữ phủ thành Đại La, tự xưng Tiết độ sứ; nhà Đường thế yếu đành công nhận. Không cần một trận đánh lớn, người Việt bắt đầu tự nắm lấy quyền cai trị đất mình sau gần một nghìn năm Bắc thuộc. Con ông là Khúc Hạo nối nghiệp, sửa sang chính sự, chia lại các đơn vị hành chính, khoan thư sức dân. Đến đời cháu là Khúc Thừa Mỹ, nước Nam Hán đem quân sang bắt đi, nền tự chủ họ Khúc tạm dứt. Ba đời họ Khúc tuy ngắn, nhưng đã đặt nền móng vững cho nền độc lập mà Dương Đình Nghệ rồi Ngô Quyền hoàn thành.",
    "en": "At the close of the Tang, the dynasty declined and fell, and China entered the turmoil of the Five Dynasties. Seizing the moment, in 905 the Hồng Châu notable Khúc Thừa Dụ led the people to take the citadel of Đại La and styled himself Military Governor; too weak to resist, the Tang recognised him. Without a single great battle, the Việt began to hold the rule of their own land after nearly a thousand years under the North. His son Khúc Hạo succeeded him, ordering the state's affairs, reorganising the administrative units and easing the people's burdens. In his grandson Khúc Thừa Mỹ's time, the Southern Han carried him off captive, and the Khúc self-rule came to a pause. The three Khúc generations were brief, but they laid a firm foundation for the independence that Dương Đình Nghệ and then Ngô Quyền would complete."
  },
  "yearRange": {
    "display": {
      "vi": "905 – 930 SCN",
      "en": "905 – 930 CE"
    },
    "startYear": 905,
    "endYear": 930
  },
  "palette": {
    "accent": "#2f80c8",
    "particle": "#e6c877",
    "scene": [
      "#050a0f",
      "#081420",
      "#0e2436",
      "#173a54",
      "#2a5578",
      "#8a6f38",
      "#5a4a28"
    ]
  },
  "cover": {
    "id": "khuc-thua-du-cover",
    "type": "image",
    "role": "cover",
    "flagship": "eras/khuc-thua-du/cover.png",
    "reduced": "eras/khuc-thua-du/cover.png",
    "placeholder": "era-scene",
    "caption": {
      "vi": "Minh họa · phong cách sơn mài",
      "en": "Illustration · lacquer style"
    }
  },
  "scene": {
    "layers": [
      {
        "id": "sky",
        "type": "image",
        "role": "sky",
        "depth": 0.0,
        "flagship": "eras/khuc-thua-du/scene/sky.png",
        "reduced": "eras/khuc-thua-du/scene/sky.png",
        "placeholder": "era-scene"
      },
      {
        "id": "motes",
        "type": "particles",
        "role": "particles",
        "depth": 1.0,
        "placeholder": "gold-motes"
      }
    ]
  },
  "primarySource": {
    "work": "Đại Việt sử ký toàn thư",
    "section": {
      "vi": "Ngoại kỷ",
      "en": "Outer Records"
    },
    "author": "Ngô Sĩ Liên"
  },
  "characters": [
    {
      "ref": "khuc-thua-du"
    },
    {
      "ref": "khuc-hao"
    },
    {
      "ref": "khuc-thua-my"
    }
  ],
  "events": [
    {
      "ref": "nha-duong-suy-vong"
    },
    {
      "ref": "khuc-thua-du-tu-chu"
    },
    {
      "ref": "khuc-hao-cai-cach"
    },
    {
      "ref": "khuc-thua-my-nam-han"
    }
  ]
}
