{
  "schemaVersion": 1,
  "id": "tay-son",
  "slug": "tay-son",
  "order": 21,
  "period": "tay-son",
  "flagship": true,
  "title": {
    "vi": "Quang Trung – Tây Sơn",
    "en": "Quang Trung and the Tây Sơn"
  },
  "kicker": {
    "vi": "Áo vải cờ đào · Đại phá quân Thanh",
    "en": "The peasant banner · the Qing shattered"
  },
  "subtitle": {
    "vi": "Người anh hùng áo vải, thống nhất sơn hà, quét sạch ngoại xâm.",
    "en": "A hero in homespun who reunited the land and swept the invaders away."
  },
  "overview": {
    "vi": "Cuối thế kỷ 18, cả hai miền đất nước đều rối loạn: ở Đàng Trong, quyền thần Trương Phúc Loan lộng hành, sưu thuế nặng nề; ở Đàng Ngoài, vua Lê chúa Trịnh suy đồi, kiêu binh làm loạn. Năm Tân Mão (1771), ba anh em Nguyễn Nhạc, Nguyễn Huệ, Nguyễn Lữ dấy binh ở đất Tây Sơn (Bình Định), nêu cờ 'lấy của nhà giàu chia cho dân nghèo', được muôn dân hưởng ứng. Phong trào lớn mạnh như vũ bão: quân Tây Sơn lần lượt diệt chúa Nguyễn ở phương Nam, rồi Nguyễn Huệ đem quân ra Bắc, lật đổ họ Trịnh, chấm dứt hơn hai trăm năm chia cắt Đàng Trong – Đàng Ngoài. Trong khi ấy, giặc ngoài hai lần kéo đến: năm Ất Tỵ (1785), Nguyễn Huệ đại phá năm vạn quân Xiêm ở Rạch Gầm – Xoài Mút; năm Mậu Thân (1788), khi Lê Chiêu Thống rước hai mươi chín vạn quân Thanh sang giày xéo Thăng Long, Nguyễn Huệ lên ngôi Hoàng đế, lấy hiệu Quang Trung, rồi hành quân thần tốc ra Bắc. Chỉ trong năm ngày Tết Kỷ Dậu (1789), ông quét sạch quân Thanh ở Ngọc Hồi – Đống Đa, làm nên một trong những chiến công hiển hách nhất của dân tộc. Lên ngôi, Quang Trung ôm hoài bão canh tân — đề cao chữ Nôm, chấn hưng học hành, chỉnh đốn kinh tế, còn định đòi lại đất Lưỡng Quảng — nhưng năm Nhâm Tý (1792) ông đột ngột băng hà khi mới bốn mươi tuổi. Nhà Tây Sơn suy yếu dần, rồi mất về tay Nguyễn Ánh; song sự nghiệp của người anh hùng áo vải mãi rạng ngời sử sách.",
    "en": "At the end of the 18th century both regions were in turmoil: in Đàng Trong the overmighty minister Trương Phúc Loan tyrannised with crushing taxes; in Đàng Ngoài the Lê kings and Trịnh lords had decayed and the palace troops ran riot. In the year Tân Mão (1771) the three brothers Nguyễn Nhạc, Nguyễn Huệ and Nguyễn Lữ rose in arms at Tây Sơn in Bình Định under the banner 'take from the rich to share with the poor,' and the people flocked to them. The movement grew like a storm: the Tây Sơn destroyed the Nguyễn lords in the south, then Nguyễn Huệ marched north and toppled the Trịnh, ending more than two hundred years of the Đàng Trong–Đàng Ngoài division. Meanwhile foreign armies came twice: in Ất Tỵ (1785) Nguyễn Huệ annihilated fifty thousand Siamese at Rạch Gầm–Xoài Mút; in Mậu Thân (1788), when Lê Chiêu Thống brought two hundred and ninety thousand Qing troops to trample Thăng Long, Nguyễn Huệ took the imperial throne as Quang Trung and marched north with lightning speed. In just five days of the Kỷ Dậu New Year (1789) he swept the Qing away at Ngọc Hồi–Đống Đa — one of the most glorious feats in the nation's history. As emperor, Quang Trung nursed ambitions of renewal — exalting the Nôm script, reviving learning, ordering the economy, even planning to reclaim the Liangguang lands — but in the year Nhâm Tý (1792) he died suddenly at only forty. The Tây Sơn weakened and at last fell to Nguyễn Ánh; yet the peasant hero's achievement shines on in history."
  },
  "yearRange": {
    "display": {
      "vi": "1771 – 1792 SCN",
      "en": "1771 – 1792 CE"
    },
    "startYear": 1771,
    "endYear": 1792
  },
  "palette": {
    "accent": "#c0392b",
    "particle": "#f2d06b",
    "scene": [
      "#160705",
      "#2a0c08",
      "#4a140d",
      "#7d2117",
      "#b23320",
      "#d98b2b",
      "#f2d06b"
    ]
  },
  "cover": {
    "id": "tay-son-cover",
    "type": "image",
    "role": "cover",
    "flagship": "eras/tay-son/cover.png",
    "reduced": "eras/tay-son/cover.png",
    "placeholder": "era-scene",
    "caption": {
      "vi": "Minh họa · phong cách sơn mài",
      "en": "Illustration · lacquer style"
    }
  },
  "scene": {
    "layers": [
      {
        "id": "sky",
        "type": "image",
        "role": "sky",
        "depth": 0.0,
        "flagship": "eras/tay-son/scene/sky.png",
        "reduced": "eras/tay-son/scene/sky.png",
        "placeholder": "era-scene"
      },
      {
        "id": "motes",
        "type": "particles",
        "role": "particles",
        "depth": 1.0,
        "placeholder": "gold-motes"
      }
    ]
  },
  "primarySource": {
    "work": "Hoàng Lê nhất thống chí",
    "section": {
      "vi": "Ngô gia văn phái",
      "en": "The Ngô Family School of Letters"
    },
    "author": "Ngô gia văn phái",
    "note": {
      "vi": "Việc ở Bắc Hà (lật Trịnh, đại phá quân Thanh) chép theo Hoàng Lê nhất thống chí — bộ ký sự lịch sử đương thời của Ngô gia văn phái; buổi đầu dấy nghĩa và việc ở phương Nam dẫn theo Đại Nam chính biên liệt truyện của Quốc sử quán triều Nguyễn (vốn gọi Tây Sơn là 'ngụy', nay chép lại sự việc một cách công bằng).",
      "en": "The northern events (toppling the Trịnh, crushing the Qing) follow the Hoàng Lê nhất thống chí — the contemporaneous historical record of the Ngô Family School; the early uprising and southern events are drawn from the Đại Nam chính biên liệt truyện of the Nguyễn dynasty's Historiography Institute (which called the Tây Sơn 'usurpers,' recounted here even-handedly)."
    }
  },
  "characters": [
    {
      "ref": "quang-trung"
    },
    {
      "ref": "nguyen-nhac"
    },
    {
      "ref": "ngo-thi-nham"
    },
    {
      "ref": "nguyen-thiep"
    },
    {
      "ref": "ton-si-nghi"
    }
  ],
  "events": [
    {
      "ref": "dung-nghia-tay-son"
    },
    {
      "ref": "rach-gam-xoai-mut"
    },
    {
      "ref": "phu-le-diet-trinh"
    },
    {
      "ref": "len-ngoi-than-toc"
    },
    {
      "ref": "ngoc-hoi-dong-da"
    },
    {
      "ref": "canh-tan-bang-ha"
    }
  ]
}
