{
  "schemaVersion": 1,
  "id": "ly-nhan-tong",
  "slug": "ly-nhan-tong",
  "order": 14,
  "period": "nha-ly",
  "title": {
    "vi": "Lý Nhân Tông & Lý Thường Kiệt",
    "en": "Lý Nhân Tông & Lý Thường Kiệt"
  },
  "kicker": {
    "vi": "Kỷ nhà Lý",
    "en": "The Lý dynasty"
  },
  "subtitle": {
    "vi": "Mở khoa thi, phá Tống, dựng nền tự chủ Đại Việt.",
    "en": "Examinations opened, the Song broken, Đại Việt's independence affirmed."
  },
  "overview": {
    "vi": "Lý Thánh Tông băng năm Nhâm Tý (1072), thái tử Càn Đức mới bảy tuổi lên ngôi, tức Lý Nhân Tông; mẹ là Ỷ Lan buông rèm nhiếp chính, có Lý Đạo Thành và Thái úy Lý Thường Kiệt phụ chính. Đời Nhân Tông là buổi cực thịnh của nhà Lý. Về văn, năm Ất Mão (1075) vua mở khoa thi Nho học đầu tiên chọn người tài, năm sau (1076) lập Quốc Tử Giám — trường học cao nhất nước, mở đầu nền khoa cử. Về võ, thấy nhà Tống sửa soạn xâm lược, Lý Thường Kiệt chủ trương 'ngồi yên đợi giặc không bằng đem quân ra trước'; năm 1075–1076, ông cùng Tôn Đản đem quân sang phá tan các châu Ung, Khâm, Liêm, triệt căn cứ của giặc rồi rút về. Năm Đinh Tỵ (1077), quân Tống do Quách Quỳ kéo sang báo thù; Lý Thường Kiệt lập phòng tuyến bên sông Như Nguyệt chặn giặc, cho vang lên bài thơ 'Nam quốc sơn hà' khẳng định chủ quyền, rồi đại phá quân Tống. Ông lại chủ động giảng hòa cho giặc rút về, giữ vẹn bờ cõi. Nước Đại Việt từ đó vững như bàn thạch; Nhân Tông ở ngôi năm mươi lăm năm, lâu nhất trong sử Việt.",
    "en": "Lý Thánh Tông died in the year Nhâm Tý (1072), and the crown prince Càn Đức, only seven, took the throne as Lý Nhân Tông; his mother Ỷ Lan ruled from behind the screen, with Lý Đạo Thành and the Grand Marshal Lý Thường Kiệt as regents. Nhân Tông's reign was the summit of the Lý. In learning: in the year Ất Mão (1075) he opened the first Confucian examination to choose men of talent, and the next year (1076) founded the Quốc Tử Giám — the realm's highest school — beginning the age of examinations. In arms: seeing the Song prepare to invade, Lý Thường Kiệt held that 'to sit and await the enemy is worse than to strike first'; in 1075–1076 he and Tôn Đản led an army to break the Song prefectures of Ung, Khâm and Liêm, destroying the enemy's bases before withdrawing. In the year Đinh Tỵ (1077) the Song under Guo Kui came in revenge; Lý Thường Kiệt raised a line along the Như Nguyệt River to bar them, had the poem 'Nam quốc sơn hà' proclaimed to assert the nation's sovereignty, and shattered the Song army. He then chose to negotiate their withdrawal, keeping the borders whole. From then Đại Việt stood firm as bedrock; Nhân Tông reigned fifty-five years, the longest in Việt history."
  },
  "yearRange": {
    "display": {
      "vi": "1072 – 1127 SCN",
      "en": "1072 – 1127 CE"
    },
    "startYear": 1072,
    "endYear": 1127
  },
  "palette": {
    "accent": "#3a4d8c",
    "particle": "#e9d9a0",
    "scene": [
      "#070a16",
      "#0d1226",
      "#161f42",
      "#233363",
      "#33508c",
      "#b9974a",
      "#7a6230"
    ]
  },
  "cover": {
    "id": "ly-nhan-tong-cover",
    "type": "image",
    "role": "cover",
    "flagship": "eras/ly-nhan-tong/cover.png",
    "reduced": "eras/ly-nhan-tong/cover.png",
    "placeholder": "era-scene",
    "caption": {
      "vi": "Minh họa · phong cách sơn mài",
      "en": "Illustration · lacquer style"
    }
  },
  "scene": {
    "layers": [
      {
        "id": "sky",
        "type": "image",
        "role": "sky",
        "depth": 0.0,
        "flagship": "eras/ly-nhan-tong/scene/sky.png",
        "reduced": "eras/ly-nhan-tong/scene/sky.png",
        "placeholder": "era-scene"
      },
      {
        "id": "motes",
        "type": "particles",
        "role": "particles",
        "depth": 1.0,
        "placeholder": "gold-motes"
      }
    ]
  },
  "primarySource": {
    "work": "Đại Việt sử ký toàn thư",
    "section": {
      "vi": "Bản kỷ",
      "en": "Basic Records"
    },
    "author": "Ngô Sĩ Liên"
  },
  "characters": [
    {
      "ref": "ly-nhan-tong"
    },
    {
      "ref": "ly-thuong-kiet"
    },
    {
      "ref": "y-lan",
      "epithet": {
        "vi": "Hoàng thái hậu nhiếp chính",
        "en": "Empress Dowager and regent"
      }
    }
  ],
  "events": [
    {
      "ref": "nhan-tong-len-ngoi"
    },
    {
      "ref": "khoa-thi-quoc-tu-giam"
    },
    {
      "ref": "tien-phat-che-nhan"
    },
    {
      "ref": "nhu-nguyet-nam-quoc-son-ha"
    },
    {
      "ref": "giang-hoa-thinh-tri"
    }
  ]
}
