{
  "schemaVersion": 1,
  "id": "mai-hac-de",
  "slug": "mai-hac-de",
  "order": 6,
  "period": "bac-thuoc",
  "title": {
    "vi": "Mai Hắc Đế",
    "en": "Mai Hắc Đế"
  },
  "kicker": {
    "vi": "Kỷ thuộc Đường",
    "en": "The age under Tang"
  },
  "subtitle": {
    "vi": "Dấy cờ Hoan Châu, xưng đế chống Đường.",
    "en": "A flag raised in Hoan Châu, an emperor against the Tang."
  },
  "overview": {
    "vi": "Sau nhà Tùy đến nhà Đường, đất Việt gọi là An Nam đô hộ phủ, chịu ách sưu cao thuế nặng và cống nạp phương vật cho phương Bắc. Đầu thế kỷ thứ tám, người Hoan Châu là Mai Thúc Loan — da đen, sức mạnh, được dân kính phục — dấy binh khởi nghĩa. Ông liên kết với Lâm Ấp, Chân Lạp, hợp binh mấy chục vạn, hạ được thành Tống Bình, đuổi quan đô hộ nhà Đường, rồi tự xưng là Mai Hắc Đế, đóng đô ở thành Vạn An đất Hoan Châu. Năm Nhâm Tuất (722), nhà Đường sai Dương Tư Húc đem mười vạn quân sang đàn áp; Mai Hắc Đế chống không nổi, lui vào rừng rồi mất. Sử chép về ông tuy ngắn, nhưng đây là một trong những lần người Việt xưng đế, dựng đô, đương đầu với cả một đế quốc phương Bắc đang thịnh.",
    "en": "After the Sui came the Tang, and the Việt land — now the An Nam Protectorate — bore high levies, heavy taxes and tribute of its goods to the North. In the early eighth century a man of Hoan Châu, Mai Thúc Loan — dark-skinned, powerful, revered by the people — raised a revolt. He joined with Lâm Ấp (Champa) and Chân Lạp (Cambodia), massed an army of hundreds of thousands, stormed the citadel of Tống Bình and drove out the Tang protector-general, then styled himself Mai Hắc Đế and set his capital at the citadel of Vạn An in Hoan Châu. In the year Nhâm Tuất (722), the Tang sent Yang Sixu with a hundred thousand troops to crush him; unable to hold, Mai Hắc Đế withdrew into the forest and died. The chronicle's record of him is brief, but this was one of the times the Việt claimed the imperial title, raised a capital, and stood against a Northern empire then at its height."
  },
  "yearRange": {
    "display": {
      "vi": "713 – 722 SCN",
      "en": "713 – 722 CE"
    },
    "startYear": 713,
    "endYear": 722
  },
  "palette": {
    "accent": "#c0392b",
    "particle": "#e6c877",
    "scene": [
      "#0a0606",
      "#150808",
      "#280d0a",
      "#431611",
      "#5f231b",
      "#8a6f38",
      "#5a4a28"
    ]
  },
  "cover": {
    "id": "mai-hac-de-cover",
    "type": "image",
    "role": "cover",
    "flagship": "eras/mai-hac-de/cover.png",
    "reduced": "eras/mai-hac-de/cover.png",
    "placeholder": "era-scene",
    "caption": {
      "vi": "Minh họa · phong cách sơn mài",
      "en": "Illustration · lacquer style"
    }
  },
  "scene": {
    "layers": [
      {
        "id": "sky",
        "type": "image",
        "role": "sky",
        "depth": 0.0,
        "flagship": "eras/mai-hac-de/scene/sky.png",
        "reduced": "eras/mai-hac-de/scene/sky.png",
        "placeholder": "era-scene"
      },
      {
        "id": "motes",
        "type": "particles",
        "role": "particles",
        "depth": 1.0,
        "placeholder": "gold-motes"
      }
    ]
  },
  "primarySource": {
    "work": "Đại Việt sử ký toàn thư",
    "section": {
      "vi": "Ngoại kỷ",
      "en": "Outer Records"
    },
    "author": "Ngô Sĩ Liên"
  },
  "characters": [
    {
      "ref": "mai-hac-de"
    },
    {
      "ref": "duong-tu-huc"
    },
    {
      "ref": "quang-so-khach"
    }
  ],
  "events": [
    {
      "ref": "ach-do-ho-nha-duong"
    },
    {
      "ref": "mai-thuc-loan-day-binh"
    },
    {
      "ref": "xung-hac-de-dung-van-an"
    },
    {
      "ref": "lien-ket-ha-tong-binh"
    },
    {
      "ref": "duong-tu-huc-dan-ap"
    }
  ]
}
