{
  "schemaVersion": 1,
  "id": "dinh-tien-hoang",
  "slug": "dinh-tien-hoang",
  "order": 10,
  "period": "ngo-dinh-tien-le",
  "title": {
    "vi": "Đinh Tiên Hoàng",
    "en": "Đinh Tiên Hoàng"
  },
  "kicker": {
    "vi": "Kỷ nhà Đinh",
    "en": "The Đinh dynasty"
  },
  "subtitle": {
    "vi": "Dẹp loạn sứ quân, dựng nước Đại Cồ Việt.",
    "en": "The warlords quelled, the realm of Đại Cồ Việt founded."
  },
  "overview": {
    "vi": "Ngô Quyền mất, nhà Ngô suy, đất nước rơi vào loạn mười hai sứ quân, mỗi người hùng cứ một phương. Ở động Hoa Lư có Đinh Bộ Lĩnh, con thứ sử Đinh Công Trứ, thuở nhỏ chăn trâu đã lấy bông lau làm cờ bày trận. Lớn lên, ông dấy binh dẹp yên các sứ quân, được tôn là Vạn Thắng Vương, thu giang sơn về một mối. Năm Mậu Thìn (968), ông lên ngôi Hoàng đế, đặt quốc hiệu Đại Cồ Việt, đóng đô ở Hoa Lư, đặt niên hiệu, định triều nghi, dựng quân đội — vị hoàng đế đầu tiên của nước Việt thống nhất. Từ Đinh Tiên Hoàng, sử nước ta bước sang phần Bản kỷ. Năm 979, ông bị hoạn quan Đỗ Thích giết hại; con nhỏ là Đinh Toàn nối ngôi, Thập đạo tướng quân Lê Hoàn nhiếp chính — mở lối sang nhà Tiền Lê.",
    "en": "When Ngô Quyền died and the Ngô waned, the land fell into the anarchy of the twelve warlords, each lording it over his own quarter. In the Hoa Lư grotto lived Đinh Bộ Lĩnh, son of the governor Đinh Công Trứ, who as a buffalo-herding boy had already used reed flowers as banners to array his mock battles. Grown, he raised troops, pacified the warlords, was honoured as the Ten-Thousand-Victories King, and gathered the realm into one. In the year Mậu Thìn (968) he took the imperial throne, named the state Đại Cồ Việt, set his capital at Hoa Lư, fixed an era name, court rites and an army — the first emperor of a unified Việt nation. With Đinh Tiên Hoàng our history crosses into the Basic Records. In 979 he was murdered by the eunuch Đỗ Thích; his young son Đinh Toàn succeeded under the regency of the Commander of the Ten Armies, Lê Hoàn — opening the road to the Early Lê."
  },
  "yearRange": {
    "display": {
      "vi": "966 – 979 SCN",
      "en": "966 – 979 CE"
    },
    "startYear": 966,
    "endYear": 979
  },
  "palette": {
    "accent": "#cc3d33",
    "particle": "#e6c877",
    "scene": [
      "#100605",
      "#1e0a08",
      "#360f0b",
      "#551a12",
      "#7a271c",
      "#8a6f38",
      "#5a4a28"
    ]
  },
  "cover": {
    "id": "dinh-tien-hoang-cover",
    "type": "image",
    "role": "cover",
    "flagship": "eras/dinh-tien-hoang/cover.png",
    "reduced": "eras/dinh-tien-hoang/cover.png",
    "placeholder": "era-scene",
    "caption": {
      "vi": "Minh họa · phong cách sơn mài",
      "en": "Illustration · lacquer style"
    }
  },
  "scene": {
    "layers": [
      {
        "id": "sky",
        "type": "image",
        "role": "sky",
        "depth": 0.0,
        "flagship": "eras/dinh-tien-hoang/scene/sky.png",
        "reduced": "eras/dinh-tien-hoang/scene/sky.png",
        "placeholder": "era-scene"
      },
      {
        "id": "motes",
        "type": "particles",
        "role": "particles",
        "depth": 1.0,
        "placeholder": "gold-motes"
      }
    ]
  },
  "primarySource": {
    "work": "Đại Việt sử ký toàn thư",
    "section": {
      "vi": "Bản kỷ",
      "en": "Basic Records"
    },
    "author": "Ngô Sĩ Liên"
  },
  "characters": [
    {
      "ref": "dinh-tien-hoang"
    },
    {
      "ref": "nguyen-bac"
    },
    {
      "ref": "le-hoan"
    },
    {
      "ref": "do-thich"
    }
  ],
  "events": [
    {
      "ref": "loan-12-su-quan"
    },
    {
      "ref": "dep-loan-thong-nhat"
    },
    {
      "ref": "lap-dai-co-viet"
    },
    {
      "ref": "dung-nen-chinh"
    },
    {
      "ref": "do-thich-thi-nghich"
    }
  ]
}
