{
  "schemaVersion": 1,
  "id": "bien-gioi-tay-nam",
  "slug": "bien-gioi-tay-nam",
  "order": 32,
  "period": "chien-tranh-bien-gioi",
  "title": {
    "vi": "Chiến tranh biên giới Việt Nam – Campuchia",
    "en": "The Vietnam–Cambodia Border War"
  },
  "kicker": {
    "vi": "Chiến tranh bảo vệ Tổ quốc ở biên giới Tây Nam (1975 – 1989)",
    "en": "Defending the Fatherland on the southwestern border (1975–1989)"
  },
  "subtitle": {
    "vi": "Từ những cuộc tấn công của Khmer Đỏ đến ngày quân tình nguyện hoàn thành nghĩa vụ quốc tế, trở về nước.",
    "en": "From Khmer Rouge attacks to the day the volunteer army completed its international duty and came home."
  },
  "overview": {
    "vi": "Ngay sau khi lên nắm quyền ở Campuchia (4/1975), tập đoàn Pol Pot – Ieng Sary (Khmer Đỏ) đã thi hành một chế độ diệt chủng tàn khốc đối với chính nhân dân mình, đồng thời liên tiếp gây hấn, đánh chiếm các đảo Phú Quốc, Thổ Chu và tổ chức nhiều cuộc tấn công vũ trang vào lãnh thổ Việt Nam dọc tuyến biên giới Tây Nam, giết hại dân thường ở An Giang, Tây Ninh, Kiên Giang, Đồng Tháp. Đỉnh điểm là vụ thảm sát Ba Chúc (An Giang) trong 12 ngày cuối tháng 4 năm 1978, khi quân Khmer Đỏ giết hại 3.157 người dân vô tội. Trước hành động xâm lược và diệt chủng đó, quân và dân ta, dưới sự chỉ huy của các tướng lĩnh như Lê Đức Anh (Tư lệnh Quân khu 9) và Lê Trọng Tấn (Tư lệnh Mặt trận Tây Nam), đã kiên quyết chiến đấu bảo vệ biên giới, rồi mở cuộc tổng phản công trên toàn tuyến từ ngày 23 tháng 12 năm 1978. Đáp lời kêu gọi của Mặt trận Đoàn kết dân tộc cứu nước Campuchia, quân tình nguyện Việt Nam cùng lực lượng vũ trang cách mạng Campuchia đã tiến công như vũ bão, giải phóng Phnôm Pênh ngày 7 tháng 1 năm 1979, lật đổ chế độ diệt chủng Pol Pot, cứu nhân dân Campuchia thoát khỏi hoạ diệt chủng. Sau đó, quân tình nguyện Việt Nam tiếp tục ở lại làm nhiệm vụ quốc tế, giúp nhân dân Campuchia hồi sinh đất nước, truy quét tàn quân Khmer Đỏ, cho đến khi hoàn thành nghĩa vụ và rút quân hoàn toàn về nước vào tháng 9 năm 1989.",
    "en": "Soon after seizing power in Cambodia (April 1975), the Pol Pot – Ieng Sary clique (the Khmer Rouge) carried out a brutal genocide against its own people, while repeatedly provoking Vietnam, seizing Phú Quốc and Thổ Chu islands and launching armed attacks into Vietnamese territory along the southwestern border, killing civilians in An Giang, Tây Ninh, Kiên Giang and Đồng Tháp. The climax was the Ba Chúc massacre (An Giang) over 12 days in late April 1978, when Khmer Rouge forces killed 3,157 innocent civilians. In the face of this aggression and genocide, Vietnamese forces and people, under commanders such as Lê Đức Anh (Commander, Military Region 9) and Lê Trọng Tấn (Commander of the Southwest Front), resolutely fought to defend the border, then launched a counter-offensive along the whole front from 23 December 1978. Answering the call of the Kampuchean National United Front for National Salvation, Vietnamese volunteer forces together with Cambodian revolutionary armed forces advanced like a storm, liberating Phnôm Pênh on 7 January 1979, overthrowing the Pol Pot genocidal regime and saving the Cambodian people from the genocide. Vietnamese volunteer forces then remained to carry out their international duty, helping Cambodia recover and hunting down remaining Khmer Rouge forces, until they completed their mission and withdrew fully in September 1989."
  },
  "yearRange": {
    "display": {
      "vi": "1975 – 1989 SCN",
      "en": "1975 – 1989 CE"
    },
    "startYear": 1975,
    "endYear": 1989
  },
  "palette": {
    "accent": "#8a5a2b",
    "particle": "#e0b23e",
    "scene": [
      "#0a0603",
      "#170d06",
      "#2e1a0c",
      "#513015",
      "#8a5a2b",
      "#b8862f",
      "#e0b23e"
    ]
  },
  "cover": {
    "id": "bien-gioi-tay-nam-cover",
    "type": "image",
    "role": "cover",
    "placeholder": "era-scene",
    "caption": {
      "vi": "Minh họa · phong cách sơn mài",
      "en": "Illustration · lacquer style"
    },
    "flagship": "eras/bien-gioi-tay-nam/cover.png",
    "reduced": "eras/bien-gioi-tay-nam/cover.png"
  },
  "scene": {
    "layers": [
      {
        "id": "sky",
        "type": "image",
        "role": "sky",
        "depth": 0.0,
        "placeholder": "era-scene",
        "flagship": "eras/bien-gioi-tay-nam/scene/sky.png",
        "reduced": "eras/bien-gioi-tay-nam/scene/sky.png"
      },
      {
        "id": "motes",
        "type": "particles",
        "role": "particles",
        "depth": 1.0,
        "placeholder": "gold-motes"
      }
    ]
  },
  "primarySource": {
    "work": "Lịch sử Quân đội nhân dân Việt Nam",
    "section": {
      "vi": "Chiến tranh bảo vệ Tổ quốc ở biên giới Tây Nam và làm nhiệm vụ quốc tế ở Campuchia (1975–1989)",
      "en": "Defending the Fatherland on the southwestern border and the international duty in Cambodia (1975–1989)"
    },
    "author": "Viện Lịch sử Quân sự Việt Nam"
  },
  "characters": [
    {
      "ref": "le-duc-anh"
    },
    {
      "ref": "le-trong-tan"
    },
    {
      "ref": "vo-nguyen-giap",
      "epithet": {
        "vi": "Bộ trưởng Bộ Quốc phòng (đến 1980)",
        "en": "Minister of Defence (until 1980)"
      }
    }
  ],
  "events": [
    {
      "ref": "khmer-do-chiem-tho-chu"
    },
    {
      "ref": "tan-cong-bien-gioi-1977"
    },
    {
      "ref": "tham-sat-ba-chuc"
    },
    {
      "ref": "tong-phan-cong-tay-nam"
    },
    {
      "ref": "giai-phong-phnom-penh"
    },
    {
      "ref": "quan-tinh-nguyen-ve-nuoc"
    }
  ]
}
