{
  "schemaVersion": 1,
  "id": "thieu-tri",
  "slug": "thieu-tri",
  "order": 24,
  "period": "nguyen",
  "title": {
    "vi": "Thiệu Trị",
    "en": "Thiệu Trị"
  },
  "kicker": {
    "vi": "Nhà Nguyễn · Buổi lặng trước cơn giông",
    "en": "The Nguyễn · the calm before the storm"
  },
  "subtitle": {
    "vi": "Vị vua thi nhân hiền hòa, và tiếng đại bác Pháp đầu tiên ở Đà Nẵng.",
    "en": "A gentle poet-emperor — and the first French cannon at Đà Nẵng."
  },
  "overview": {
    "vi": "Năm Tân Sửu (1841), vua Minh Mạng băng, con trưởng là Nguyễn Phúc Miên Tông nối ngôi, lấy niên hiệu Thiệu Trị. So với vua cha nghiêm khắc và quyết đoán, Thiệu Trị là bậc vua hiền hòa, nhân hậu, hiếu thảo, đặc biệt say mê văn chương thi phú — ông để lại hàng nghìn bài thơ, trong đó nổi tiếng với lối thơ 'hồi văn' đọc xuôi đọc ngược đều thành bài. Về đường lối, ông cơ bản giữ nguyên khuôn phép cai trị của Minh Mạng: quân chủ tập quyền, sùng Nho, tiếp tục cấm đạo Thiên Chúa và bế quan tỏa cảng. Việc lớn đầu triều là giải quyết cái gánh nặng Trấn Tây: sau nhiều năm sa lầy tốn kém ở đất Cao Miên, quân dân Chân Lạp nổi dậy khắp nơi, lại thêm chiến tranh với Xiêm, triều đình đành cho rút quân khỏi Trấn Tây (1841), rồi qua mấy năm giao tranh và điều đình, đi tới dàn xếp để Cao Miên chịu triều cống cả hai nước Việt – Xiêm. Bảy năm trị vì của Thiệu Trị nhìn bề ngoài êm ả, nhưng thực ra là buổi lặng trước cơn giông: ở phương Tây, các nước tư bản đang bành trướng, và mối đe dọa đã gõ cửa. Năm Đinh Mùi (1847), lấy cớ bênh vực giáo sĩ bị giam, tàu chiến Pháp kéo đến cửa biển Đà Nẵng, khai hỏa bắn chìm mấy chiếc thuyền của thủy quân triều đình rồi bỏ đi — lần đầu tiên đại bác phương Tây nổ trên bờ biển nước ta, báo hiệu tai họa xâm lăng sắp tới. Vua Thiệu Trị vô cùng tức giận, càng thêm nghiêm lệnh cấm đạo và phòng bị; nhưng chỉ ít lâu sau, cùng năm ấy, ông lâm bệnh mà mất, để lại ngôi báu và một cơ nghiệp đang đứng trước sóng gió cho con thứ là Hồng Nhậm — tức vua Tự Đức.",
    "en": "In the year Tân Sửu (1841), Minh Mạng died and his eldest son Nguyễn Phúc Miên Tông succeeded under the era-name Thiệu Trị. Beside his stern and decisive father, Thiệu Trị was a gentle, humane and filial ruler, especially devoted to letters and poetry — he left thousands of poems, famous among them the 'palindrome' verses that read as poetry both forward and backward. In policy he largely kept Minh Mạng's ways: centralised monarchy, reverence for Confucianism, and the continued banning of Christianity and closing of the ports. His first great task was the burden of Trấn Tây: after years of costly quagmire in the Khmer land, with the Cambodians rising everywhere and war with Siam besides, the court withdrew the army from Trấn Tây (1841), and after some years of fighting and negotiation reached a settlement by which Cambodia paid tribute to both Vietnam and Siam. Thiệu Trị's seven years looked calm on the surface, but were in truth the lull before the storm: in the West the capitalist powers were expanding, and the threat had come knocking. In the year Đinh Mùi (1847), on the pretext of defending imprisoned missionaries, French warships came to the harbour of Đà Nẵng, opened fire and sank several vessels of the royal navy, then left — the first time Western cannon thundered on our shores, an omen of the invasion to come. Enraged, Thiệu Trị tightened his edicts against the faith and his defences; but soon after, that same year, he fell ill and died, leaving the throne and an imperiled realm to his younger son Hồng Nhậm — the emperor Tự Đức."
  },
  "yearRange": {
    "display": {
      "vi": "1841 – 1847 SCN",
      "en": "1841 – 1847 CE"
    },
    "startYear": 1841,
    "endYear": 1847
  },
  "palette": {
    "accent": "#c0862e",
    "particle": "#ecd196",
    "scene": [
      "#140c07",
      "#25150b",
      "#412413",
      "#6f3a1a",
      "#9c611f",
      "#c0862e",
      "#e7c77e"
    ]
  },
  "cover": {
    "id": "thieu-tri-cover",
    "type": "image",
    "role": "cover",
    "flagship": "eras/thieu-tri/cover.png",
    "reduced": "eras/thieu-tri/cover.png",
    "placeholder": "era-scene",
    "caption": {
      "vi": "Minh họa · phong cách sơn mài",
      "en": "Illustration · lacquer style"
    }
  },
  "scene": {
    "layers": [
      {
        "id": "sky",
        "type": "image",
        "role": "sky",
        "depth": 0.0,
        "flagship": "eras/thieu-tri/scene/sky.png",
        "reduced": "eras/thieu-tri/scene/sky.png",
        "placeholder": "era-scene"
      },
      {
        "id": "motes",
        "type": "particles",
        "role": "particles",
        "depth": 1.0,
        "placeholder": "gold-motes"
      }
    ]
  },
  "primarySource": {
    "work": "Đại Nam thực lục",
    "section": {
      "vi": "Chính biên · Đệ tam kỷ",
      "en": "Primary Compilation · Third Reign"
    },
    "author": "Quốc sử quán triều Nguyễn"
  },
  "characters": [
    {
      "ref": "thieu-tri"
    },
    {
      "ref": "nguyen-tri-phuong"
    },
    {
      "ref": "truong-dang-que"
    }
  ],
  "events": [
    {
      "ref": "len-ngoi-thieu-tri"
    },
    {
      "ref": "rut-khoi-tran-tay"
    },
    {
      "ref": "vua-thi-nhan"
    },
    {
      "ref": "phao-ham-da-nang"
    },
    {
      "ref": "vua-bang-truyen-ngoi"
    }
  ]
}
