{
  "schemaVersion": 1,
  "id": "ba-trieu",
  "slug": "ba-trieu",
  "order": 4,
  "period": "bac-thuoc",
  "title": {
    "vi": "Bà Triệu",
    "en": "Lady Triệu"
  },
  "kicker": {
    "vi": "Kỷ thuộc Ngô",
    "en": "The age under Wu"
  },
  "subtitle": {
    "vi": "Thà cưỡi gió đạp sóng, quyết không khom lưng.",
    "en": "Sooner ride the wind and waves than ever stoop and bow."
  },
  "overview": {
    "vi": "Sau khi Hai Bà Trưng thất bại, người Việt lại chìm trong hơn hai trăm năm Bắc thuộc, trải các đời Hán, rồi Sĩ Nhiếp, rồi thuộc về nhà Đông Ngô. Giữa thế kỷ thứ ba, ách sưu thuế lao dịch của nhà Ngô đè nặng đất Cửu Chân. Năm Mậu Thìn (248), người con gái Cửu Chân là Triệu Thị Trinh cùng anh là Triệu Quốc Đạt dấy binh, họp quân trong núi đánh phá thành ấp, các bộ đều theo như bóng theo hình. Cuộc khởi nghĩa bị Thứ sử Lục Dận đàn áp, Bà Triệu tuẫn tiết trên núi Tùng khi mới ngoài hai mươi. Sử chép về bà tuy ngắn, nhưng khí phách 'cưỡi gió đạp sóng' của người nữ tướng đất Cửu Chân thì lưu mãi trong lòng dân — phần nhiều nhờ dã sử và truyền tụng dân gian đời sau.",
    "en": "After the Trưng Sisters fell, the Việt sank again into more than two centuries under the North — through the Han, then Shi Xie, then the dominion of Eastern Wu. By the mid-third century the levies and forced labour of Wu bore hard on Cửu Chân. In the year Mậu Thìn (248), the Cửu Chân woman Triệu Thị Trinh and her brother Triệu Quốc Đạt raised troops, gathered in the mountains and stormed the citadels, the regions following her like a shadow follows a form. The Inspector Lu Yin crushed the revolt, and Lady Triệu took her own life on Mount Tùng, barely past twenty. The chronicle's record of her is brief, but the 'ride the wind and waves' defiance of the woman-general of Cửu Chân endures in the people's memory — carried in large part by later folk histories and tradition."
  },
  "yearRange": {
    "display": {
      "vi": "248 SCN",
      "en": "248 CE"
    },
    "startYear": 248,
    "endYear": 248
  },
  "palette": {
    "accent": "#c9a227",
    "particle": "#e6c877",
    "scene": [
      "#0a0a06",
      "#14130a",
      "#242010",
      "#3d3416",
      "#5f5326",
      "#8a6f38",
      "#5a4a28"
    ]
  },
  "cover": {
    "id": "ba-trieu-cover",
    "type": "image",
    "role": "cover",
    "flagship": "eras/ba-trieu/cover.png",
    "reduced": "eras/ba-trieu/cover.png",
    "placeholder": "era-scene",
    "caption": {
      "vi": "Minh họa · phong cách sơn mài",
      "en": "Illustration · lacquer style"
    }
  },
  "scene": {
    "layers": [
      {
        "id": "sky",
        "type": "image",
        "role": "sky",
        "depth": 0.0,
        "flagship": "eras/ba-trieu/scene/sky.png",
        "reduced": "eras/ba-trieu/scene/sky.png",
        "placeholder": "era-scene"
      },
      {
        "id": "motes",
        "type": "particles",
        "role": "particles",
        "depth": 1.0,
        "placeholder": "gold-motes"
      }
    ]
  },
  "primarySource": {
    "work": "Đại Việt sử ký toàn thư",
    "section": {
      "vi": "Ngoại kỷ",
      "en": "Outer Records"
    },
    "author": "Ngô Sĩ Liên"
  },
  "characters": [
    {
      "ref": "ba-trieu"
    },
    {
      "ref": "trieu-quoc-dat"
    },
    {
      "ref": "luc-dan"
    }
  ],
  "events": [
    {
      "ref": "ach-do-ho-nha-ngo"
    },
    {
      "ref": "nguoi-con-gai-cuu-chan"
    },
    {
      "ref": "khoi-nghia-mau-thin"
    },
    {
      "ref": "luc-dan-ba-trieu-tuan-tiet"
    }
  ]
}
