{
  "schemaVersion": 1,
  "id": "nha-trieu",
  "slug": "nha-trieu",
  "order": 2,
  "period": "nha-trieu",
  "title": {
    "vi": "Nam Việt",
    "en": "Nam Việt"
  },
  "kicker": {
    "vi": "Kỷ nhà Triệu",
    "en": "The House of Triệu"
  },
  "subtitle": {
    "vi": "Một cõi đế vương, rồi ngàn năm Bắc thuộc.",
    "en": "A sovereign realm — then a thousand years under the North."
  },
  "overview": {
    "vi": "Triệu Đà, viên quan úy nhà Tần, nhân loạn mà chiếm đất phương Nam, thôn tính Âu Lạc, lập nước Nam Việt và xưng đế ngang hàng với nhà Hán. Trải năm đời vua, triều Triệu vừa xưng thần vừa giữ thế tự chủ; đến khi Cù thái hậu mưu đem nước hàng Hán, chỉ còn tể tướng Lữ Gia một lòng chống giữ. Năm 111 TCN, quân Hán phá Phiên Ngung, Nam Việt mất — mở đầu hơn một nghìn năm Bắc thuộc. Sử thần Ngô Sĩ Liên chép nhà Triệu thành một kỷ chính thống; đời sau lại bàn Triệu là ngoại tộc — đây là chương gây tranh luận nhất trong Ngoại kỷ.",
    "en": "Triệu Đà, a Qin commandery officer, seized the southern lands amid the empire's collapse, annexed Âu Lạc, founded Nam Việt and styled himself emperor, a peer to Han. Across five reigns the House of Triệu played vassal abroad while holding its own at home; when the queen dowager Cù plotted to surrender the realm to Han, only the chancellor Lữ Gia held firm. In 111 BCE the Han armies stormed Phiên Ngung and Nam Việt fell — opening more than a thousand years of Northern domination. Ngô Sĩ Liên set the Triệu down as a legitimate reign; later historians called them foreigners — the most debated chapter in the Outer Records."
  },
  "yearRange": {
    "display": {
      "vi": "207 – 111 TCN",
      "en": "207 – 111 BCE"
    },
    "startYear": -207,
    "endYear": -111
  },
  "palette": {
    "accent": "#9c4f4a",
    "particle": "#e6c877",
    "scene": [
      "#0b0605",
      "#160a09",
      "#2a1210",
      "#42201c",
      "#5c3a2e",
      "#8a6f38",
      "#5a4a28"
    ]
  },
  "cover": {
    "id": "nha-trieu-cover",
    "type": "image",
    "role": "cover",
    "flagship": "eras/nha-trieu/cover.png",
    "reduced": "eras/nha-trieu/cover.png",
    "placeholder": "era-scene",
    "caption": {
      "vi": "Minh họa · phong cách sơn mài",
      "en": "Illustration · lacquer style"
    }
  },
  "scene": {
    "layers": [
      {
        "id": "sky",
        "type": "image",
        "role": "sky",
        "depth": 0.0,
        "flagship": "eras/nha-trieu/scene/sky.png",
        "reduced": "eras/nha-trieu/scene/sky.png",
        "placeholder": "era-scene"
      },
      {
        "id": "ridge-far",
        "type": "image",
        "role": "mid",
        "depth": 0.45,
        "flagship": "eras/nha-trieu/scene/ridge-far.png",
        "reduced": "eras/nha-trieu/scene/ridge-far.png",
        "placeholder": "ridge"
      },
      {
        "id": "ridge-near",
        "type": "image",
        "role": "foreground",
        "depth": 0.8,
        "flagship": "eras/nha-trieu/scene/ridge-near.png",
        "reduced": "eras/nha-trieu/scene/ridge-near.png",
        "placeholder": "ridge"
      },
      {
        "id": "motes",
        "type": "particles",
        "role": "particles",
        "depth": 1.0,
        "placeholder": "gold-motes"
      }
    ]
  },
  "primarySource": {
    "work": "Đại Việt sử ký toàn thư",
    "section": {
      "vi": "Ngoại kỷ",
      "en": "Outer Records"
    },
    "author": "Ngô Sĩ Liên"
  },
  "characters": [
    {
      "ref": "trieu-da",
      "name": {
        "vi": "Triệu Vũ Đế",
        "en": "Triệu Vũ Đế"
      },
      "epithet": {
        "vi": "Vua dựng Nam Việt",
        "en": "Founder of Nam Việt"
      },
      "bio": {
        "vi": "Người huyện Chân Định, vốn là quan úy nhà Tần ở quận Nam Hải. Nhân nhà Tần sụp đổ, ông đóng cửa ải, chiếm ba quận phương Nam, đánh lấy Âu Lạc của An Dương Vương rồi lập nước Nam Việt, đóng đô Phiên Ngung, tự xưng đế. Ông sống rất thọ, trị vì hơn bảy mươi năm, giữ thế ngang hàng với nhà Hán — người mở đầu nhà Triệu trong Ngoại kỷ.",
        "en": "A man of Chân Định and once a Qin commandery officer in Nam Hải. As the Qin collapsed he sealed the passes, seized the three southern commanderies, took An Dương Vương's Âu Lạc, and founded Nam Việt with its capital at Phiên Ngung, styling himself emperor. Long-lived, he reigned more than seventy years and held his own against Han — the founder of the House of Triệu in the Outer Records."
      }
    },
    {
      "ref": "trieu-van-de"
    },
    {
      "ref": "lu-gia"
    },
    {
      "ref": "cu-thi"
    },
    {
      "ref": "trieu-ai-vuong"
    },
    {
      "ref": "trieu-kien-duc"
    }
  ],
  "events": [
    {
      "ref": "trieu-vu-de-lap-nam-viet"
    },
    {
      "ref": "xung-de-hoa-han"
    },
    {
      "ref": "van-de-noi-nghiep"
    },
    {
      "ref": "cu-hau-va-lu-gia"
    },
    {
      "ref": "nha-trieu-mat-nuoc"
    }
  ]
}
